[
  {
    "id": "clf-d2-t2.2-artifact-hipaa-001",
    "exam": "CLF-C02",
    "level": "expert",
    "domain": 2,
    "task": "2.2",
    "style": "scenario",
    "difficulty": 4,
    "scenario": {
      "title": "HIPAA agreement readiness",
      "stem": "A healthcare analytics company is moving a regulated workload to AWS and the compliance team needs to review HIPAA-related agreements and confirm which AWS accounts are covered before protected health information is processed. The team does not want a manual ticket workflow and needs a self-service source of truth for agreements. Which AWS service should they use?",
      "business_context": [
        "regulated migration",
        "account coverage validation",
        "self-service compliance workflow"
      ],
      "constraints": [
        "agreement review before production",
        "organization-wide visibility",
        "no manual evidence chase"
      ]
    },
    "options": [
      {
        "id": "A",
        "label": "AWS Artifact",
        "is_correct": true,
        "rationale": "It is the service for reviewing and managing AWS agreements and compliance documents."
      },
      {
        "id": "B",
        "label": "AWS Security Hub",
        "is_correct": false,
        "rationale": "It centralizes findings and compliance posture, but it does not manage AWS agreements."
      },
      {
        "id": "C",
        "label": "Amazon Macie",
        "is_correct": false,
        "rationale": "It helps discover sensitive data in S3, but it does not provide agreement acceptance workflows."
      },
      {
        "id": "D",
        "label": "AWS Trusted Advisor",
        "is_correct": false,
        "rationale": "It provides recommendations and checks, not legal agreement management."
      }
    ],
    "answer": {
      "correct_option_ids": ["A"],
      "explanation": "AWS Artifact is the best fit because it allows teams to review and manage agreements such as HIPAA BAAs and confirm account or organization coverage before handling PHI.",
      "why_others_fail": [
        "Security Hub reports findings, not agreement status.",
        "Macie classifies data, not agreements.",
        "Trusted Advisor provides best-practice guidance, not compliance agreement workflows."
      ]
    },
    "aws_docs": {
      "sources": [
        {
          "service": "AWS Artifact",
          "doc_type": "compliance",
          "url": "https://docs.aws.amazon.com/artifact/latest/ug/managing-agreements.html",
          "section_titles": ["Managing agreements in AWS Artifact"],
          "snippet_markdown": "You can use AWS Artifact to review and manage agreements for your AWS account or organization. Organizations can accept agreements such as a BAA on behalf of all member accounts."
        }
      ],
      "deep_dive_primary_url": "https://docs.aws.amazon.com/artifact/latest/ug/managing-agreements.html",
      "deep_dive_sections": ["Managing agreements in AWS Artifact"]
    },
    "generation": {
      "template_id": "d2_artifact_hipaa",
      "variant_key": "organization-hipaa-agreements",
      "generated_at": "2026-04-07",
      "generator_version": "1.0.0",
      "review_status": "reviewed"
    },
    "quality": {
      "distractor_rule": "All distractors are real AWS security services that are adjacent to compliance but do not manage agreements.",
      "anti_patterns_checked": [
        "no definition wording",
        "no hint-heavy answer labels",
        "all distractors are plausible but fail one requirement"
      ]
    },
    "ui": {
      "deep_dive_enabled": true,
      "flaggable": true
    }
  },
  {
    "id": "clf-d2-t2.2-cloudwatch-logs-002",
    "exam": "CLF-C02",
    "level": "expert",
    "domain": 2,
    "task": "2.2",
    "style": "scenario",
    "difficulty": 4,
    "scenario": {
      "title": "Cross-service troubleshooting logs",
      "stem": "A retail platform is troubleshooting intermittent checkout failures across application components and AWS services. Engineers want one place to store, search, and analyze logs instead of pulling data from multiple systems during each incident. The operations lead wants centralized log visibility without building a custom pipeline first. Which AWS service best fits?",
      "business_context": [
        "incident troubleshooting",
        "cross-service observability",
        "central log storage and search"
      ],
      "constraints": [
        "single log destination",
        "searchable operational data",
        "minimal custom plumbing"
      ]
    },
    "options": [
      {
        "id": "A",
        "label": "AWS CloudTrail",
        "is_correct": false,
        "rationale": "It records API activity, but it is not the general-purpose centralized application log service described here."
      },
      {
        "id": "B",
        "label": "Amazon CloudWatch Logs",
        "is_correct": true,
        "rationale": "It centralizes, stores, searches, and analyzes logs from applications and AWS services."
      },
      {
        "id": "C",
        "label": "AWS Key Management Service (AWS KMS)",
        "is_correct": false,
        "rationale": "It manages encryption keys, not operational log storage."
      },
      {
        "id": "D",
        "label": "Amazon Inspector",
        "is_correct": false,
        "rationale": "It scans for vulnerabilities, not centralized log troubleshooting."
      }
    ],
    "answer": {
      "correct_option_ids": ["B"],
      "explanation": "Amazon CloudWatch Logs is the best fit because it centralizes logs from systems, applications, and AWS services so engineers can search and analyze them during incidents.",
      "why_others_fail": [
        "CloudTrail focuses on AWS API activity rather than general application and service logs.",
        "KMS manages keys rather than log ingestion and analysis.",
        "Inspector scans workloads but does not act as a log platform."
      ]
    },
    "aws_docs": {
      "sources": [
        {
          "service": "Amazon CloudWatch Logs",
          "doc_type": "best_practices",
          "url": "https://docs.aws.amazon.com/AmazonCloudWatch/latest/logs/WhatIsCloudWatchLogs.html",
          "section_titles": ["What is Amazon CloudWatch Logs?", "Features"],
          "snippet_markdown": "CloudWatch Logs enables you to centralize logs from systems, applications, and AWS services in a single, highly scalable service. Teams can then view, search, filter, archive, and analyze log data with CloudWatch Logs Insights."
        }
      ],
      "deep_dive_primary_url": "https://docs.aws.amazon.com/AmazonCloudWatch/latest/logs/WhatIsCloudWatchLogs.html",
      "deep_dive_sections": ["What is Amazon CloudWatch Logs?", "Features"]
    },
    "generation": {
      "template_id": "d2_logs_centralization",
      "variant_key": "checkout-troubleshooting-central-logs",
      "generated_at": "2026-04-07",
      "generator_version": "1.0.0",
      "review_status": "reviewed"
    },
    "quality": {
      "distractor_rule": "All distractors are real AWS services commonly confused with logging or security operations but fail the central-log requirement.",
      "anti_patterns_checked": [
        "no definition wording",
        "no hint-heavy answer labels",
        "all distractors are plausible but fail one requirement"
      ]
    },
    "ui": {
      "deep_dive_enabled": true,
      "flaggable": true
    }
  }
]
