[
  {
    "id": "clf-d3-t3.3-lambda-batch-001",
    "exam": "CLF-C02",
    "level": "expert",
    "domain": 3,
    "task": "3.3",
    "style": "scenario",
    "difficulty": 4,
    "scenario": {
      "title": "Nightly batch with low ops overhead",
      "stem": "A startup receives image uploads throughout the day and wants to process them once every night in a short batch window. The engineering team does not want to manage servers or cluster capacity, and the workload is small enough to fit a lightweight event-driven design. Leadership wants the lowest operational overhead while keeping the architecture simple. Which compute service is the best fit?",
      "business_context": [
        "nightly image processing",
        "lightweight batch workload",
        "simple operating model"
      ],
      "constraints": [
        "no server management",
        "low operational overhead",
        "fit within service quotas"
      ]
    },
    "options": [
      {
        "id": "A",
        "label": "AWS Lambda",
        "is_correct": true,
        "rationale": "It is best for small, event-driven or scheduled workloads when the team wants to avoid server management."
      },
      {
        "id": "B",
        "label": "AWS Fargate",
        "is_correct": false,
        "rationale": "It removes server management, but it adds container orchestration complexity that is unnecessary for this lightweight batch use case."
      },
      {
        "id": "C",
        "label": "Amazon EC2 Spot Instances",
        "is_correct": false,
        "rationale": "It can lower cost, but the team would still manage instances and job scheduling."
      },
      {
        "id": "D",
        "label": "AWS Elastic Beanstalk",
        "is_correct": false,
        "rationale": "It is aimed at managed application environments, not the simplest scheduled batch pattern here."
      }
    ],
    "answer": {
      "correct_option_ids": ["A"],
      "explanation": "AWS Lambda is the best fit because the workload is scheduled, lightweight, and explicitly optimized for low operational overhead. The main design check is ensuring the workload fits Lambda configuration and quota boundaries.",
      "why_others_fail": [
        "Fargate is close, but it introduces container lifecycle and task orchestration overhead the scenario does not need.",
        "EC2 Spot can be cost-efficient, but it still requires server management.",
        "Elastic Beanstalk is not the most direct fit for a simple nightly batch job."
      ]
    },
    "aws_docs": {
      "sources": [
        {
          "service": "AWS Lambda",
          "doc_type": "best_practices",
          "url": "https://docs.aws.amazon.com/lambda/latest/dg/best-practices.html",
          "section_titles": ["Function configuration", "Security best practices"],
          "snippet_markdown": "AWS recommends performance testing Lambda memory settings and understanding quotas before selecting the service for a workload. Lambda best practices also emphasize restrictive IAM permissions and right-sized function configuration."
        },
        {
          "service": "Amazon ECS",
          "doc_type": "service_quotas",
          "url": "https://docs.aws.amazon.com/AmazonECS/latest/developerguide/service-quotas.html",
          "section_titles": ["Amazon ECS service quotas"],
          "snippet_markdown": "Amazon ECS uses per-Region service quotas, and requests fail if those limits are exceeded. Teams should plan quota increases in advance when evaluating scale-heavy container options."
        }
      ],
      "deep_dive_primary_url": "https://docs.aws.amazon.com/lambda/latest/dg/best-practices.html",
      "deep_dive_sections": ["Function configuration", "Security best practices"]
    },
    "generation": {
      "template_id": "d3_lambda_batch_low_ops",
      "variant_key": "nightly-image-batch-low-ops",
      "generated_at": "2026-04-07",
      "generator_version": "1.0.0",
      "review_status": "reviewed"
    },
    "quality": {
      "distractor_rule": "All distractors are real AWS compute services that nearly fit but fail the simplicity or operational-overhead requirement.",
      "anti_patterns_checked": [
        "no definition wording",
        "no hint-heavy answer labels",
        "all distractors are plausible but fail one requirement"
      ]
    },
    "ui": {
      "deep_dive_enabled": true,
      "flaggable": true
    }
  },
  {
    "id": "clf-d3-t3.3-ecs-quotas-002",
    "exam": "CLF-C02",
    "level": "expert",
    "domain": 3,
    "task": "3.3",
    "style": "scenario",
    "difficulty": 4,
    "scenario": {
      "title": "Container launch planning under quota pressure",
      "stem": "A media streaming provider plans to launch a containerized service into several Regions and expects a sharp spike in task count during major events. The platform team wants to avoid failed scale-out requests caused by account-level defaults, and it does not want the first warning to come from a customer-facing outage. Which action best addresses this requirement?",
      "business_context": [
        "multi-Region container launch",
        "spiky demand profile",
        "pre-launch scaling readiness"
      ],
      "constraints": [
        "avoid quota-related failures",
        "plan before launch day",
        "minimal customer impact"
      ]
    },
    "options": [
      {
        "id": "A",
        "label": "Review Amazon ECS service quotas and request increases ahead of launch",
        "is_correct": true,
        "rationale": "That directly addresses per-Region ECS quotas that can block scale-out requests."
      },
      {
        "id": "B",
        "label": "Rely only on Amazon CloudWatch alarms after launch",
        "is_correct": false,
        "rationale": "That is reactive and does not prevent quota-related request failures in advance."
      },
      {
        "id": "C",
        "label": "Use larger container images to avoid scaling issues",
        "is_correct": false,
        "rationale": "Container image size does not solve service quota bottlenecks."
      },
      {
        "id": "D",
        "label": "Move the workload to Amazon S3",
        "is_correct": false,
        "rationale": "S3 is not a container runtime or quota-planning action."
      }
    ],
    "answer": {
      "correct_option_ids": ["A"],
      "explanation": "The best answer is to review Amazon ECS service quotas and request increases before launch because the official documentation states that requests fail when quotas are exceeded.",
      "why_others_fail": [
        "CloudWatch can alert after the fact, but it does not raise quotas.",
        "Container image size is unrelated to account-level ECS quotas.",
        "Amazon S3 does not solve container scaling controls."
      ]
    },
    "aws_docs": {
      "sources": [
        {
          "service": "Amazon ECS",
          "doc_type": "service_quotas",
          "url": "https://docs.aws.amazon.com/AmazonECS/latest/developerguide/service-quotas.html",
          "section_titles": ["Amazon ECS service quotas"],
          "snippet_markdown": "Amazon ECS sets default quotas on resources on a per-Region basis. If you attempt to exceed a quota for a resource, the request fails, so teams should plan quota increases in advance."
        }
      ],
      "deep_dive_primary_url": "https://docs.aws.amazon.com/AmazonECS/latest/developerguide/service-quotas.html",
      "deep_dive_sections": ["Amazon ECS service quotas"]
    },
    "generation": {
      "template_id": "d3_ecs_quota_planning",
      "variant_key": "event-spike-prelaunch-quotas",
      "generated_at": "2026-04-07",
      "generator_version": "1.0.0",
      "review_status": "reviewed"
    },
    "quality": {
      "distractor_rule": "All distractors are real AWS actions or services that are adjacent to operations but do not solve the quota-prevention requirement.",
      "anti_patterns_checked": [
        "no definition wording",
        "no hint-heavy answer labels",
        "all distractors are plausible but fail one requirement"
      ]
    },
    "ui": {
      "deep_dive_enabled": true,
      "flaggable": true
    }
  }
]
